{
  "schemaVersion": 1,
  "id": "escaped-dollar",
  "title": "Escaped literal formula and awk placeholder",
  "description": "Original synthetic, intentionally prepared local fixture. No downloaded skill code executes.",
  "tags": [
    "synthetic"
  ],
  "client": {
    "adapter": "claude-code",
    "supportedVersion": "2.1.280"
  },
  "skillDirectory": "skill/escaped-dollar",
  "invocation": {
    "kind": "explicit-command",
    "commandName": "escaped-dollar",
    "args": [
      "one",
      "two",
      "three",
      "four",
      "five",
      "six",
      "seven"
    ]
  },
  "expectedStages": {
    "body": "required",
    "reference-read": "optional"
  },
  "checks": [
    {
      "id": "body-text",
      "stage": "body",
      "sourceFile": "skill/escaped-dollar/SKILL.md",
      "sentinels": {
        "begin": "<!-- SP_escaped-dollar_BEGIN -->",
        "end": "<!-- SP_escaped-dollar_END -->"
      },
      "expectedText": "\nFormula =B5*(1+$B$6)\nawk '{print $1}'\nLiteral $6\n",
      "mode": "exact-text",
      "expectedOccurrences": 1,
      "normalization": "none"
    }
  ],
  "limits": {
    "inputBytes": 262144,
    "requestBytes": 8388608,
    "turns": 8,
    "timeoutMs": 30000
  },
  "golden": {
    "author": "mikonyaa / SkillParcel synthetic corpus",
    "basis": "Author expects the documented backslash escape to render a literal dollar-digit.",
    "createdAt": "2026-10-11T21:37:09.553Z"
  }
}
