{
  "schemaVersion": 1,
  "id": "unicode-empty",
  "title": "UTF-8, combining character and an empty fragment",
  "description": "Original synthetic, intentionally prepared local fixture. No downloaded skill code executes.",
  "tags": [
    "synthetic"
  ],
  "client": {
    "adapter": "claude-code",
    "supportedVersion": "2.1.280"
  },
  "skillDirectory": "skill/unicode-empty",
  "invocation": {
    "kind": "explicit-command",
    "commandName": "unicode-empty",
    "args": []
  },
  "expectedStages": {
    "body": "required",
    "reference-read": "optional"
  },
  "checks": [
    {
      "id": "body-text",
      "stage": "body",
      "sourceFile": "skill/unicode-empty/SKILL.md",
      "sentinels": {
        "begin": "<!-- SP_unicode-empty_BEGIN -->",
        "end": "<!-- SP_unicode-empty_END -->"
      },
      "expectedText": "\nПривет · 世界 · 👋 · é\n\n<!-- EMPTY_BEGIN --><!-- EMPTY_END -->\n",
      "mode": "exact-text",
      "expectedOccurrences": 1,
      "normalization": "none"
    },
    {
      "id": "empty-fragment",
      "stage": "body",
      "sourceFile": "skill/unicode-empty/SKILL.md",
      "sentinels": {
        "begin": "<!-- EMPTY_BEGIN -->",
        "end": "<!-- EMPTY_END -->"
      },
      "expectedText": "",
      "mode": "exact-text",
      "expectedOccurrences": 1,
      "normalization": "none"
    }
  ],
  "limits": {
    "inputBytes": 262144,
    "requestBytes": 8388608,
    "turns": 8,
    "timeoutMs": 30000
  },
  "golden": {
    "author": "mikonyaa / SkillParcel synthetic corpus",
    "basis": "Author requires exact source text between its explicit sentinels, before any native run.",
    "createdAt": "2026-10-11T21:37:09.553Z"
  }
}
